{
  "schema_version": "1.0",
  "case": "version-out-of-range",
  "description": "Values that would otherwise look safe (cleanupPeriodDays, DISABLE_TELEMETRY) or simply be unset (the three env-only rules with no configured value here) all conservatively produce a stale-ruleset result for every claude-code rule once the synthetic version is beyond the tested range.",
  "expected_report": {
    "ruleset_version": "2026.08.13",
    "network_requests_made": 0,
    "tools": [
      {
        "tool": "claude-code",
        "detected_version": "9.9.9",
        "detection_confidence": "high",
        "rules_last_verified_version": "2.1.223",
        "rules_verified_date": "2026-08-13",
        "version_in_range": false,
        "findings": [
          {
            "rule_id": "claude-code-cleanup-period-01",
            "status": "stale-ruleset",
            "severity": null,
            "confidence": null,
            "evidence_class": "official-documentation",
            "message": "Unverified — last-known rule indicates: The inspected user-level config keeps the local session transcript retention window at or under Claude Code's documented 30-day default. Observed: cleanupPeriodDays = 20.",
            "observation": "cleanupPeriodDays = 20",
            "remediation": null,
            "source": {
              "url": "https://code.claude.com/docs/en/settings",
              "retrieved": "2026-08-13"
            },
            "valid_from": "<=2.1.223",
            "valid_until": "2.1.223",
            "unknown_reason": null,
            "verify_url": null,
            "stale_reason": "detected version 9.9.9 is outside every tested range (max tested 2.1.223)"
          },
          {
            "rule_id": "claude-code-error-reporting-opt-out-01",
            "status": "stale-ruleset",
            "severity": null,
            "confidence": null,
            "evidence_class": "official-documentation",
            "message": "Unverified — last-known rule indicates: Effective error-reporting posture cannot be determined from an unset user-level value because uninspected configuration layers and the ambient process environment may supply or override it. Observed: env.DISABLE_ERROR_REPORTING unset in user config.",
            "observation": "env.DISABLE_ERROR_REPORTING unset in user config",
            "remediation": null,
            "source": {
              "url": "https://code.claude.com/docs/en/data-usage",
              "retrieved": "2026-08-13"
            },
            "valid_from": "<=2.1.223",
            "valid_until": "2.1.223",
            "unknown_reason": null,
            "verify_url": null,
            "stale_reason": "detected version 9.9.9 is outside every tested range (max tested 2.1.223)"
          },
          {
            "rule_id": "claude-code-feedback-command-opt-out-01",
            "status": "stale-ruleset",
            "severity": null,
            "confidence": null,
            "evidence_class": "official-documentation",
            "message": "Unverified — last-known rule indicates: Effective /feedback command posture cannot be determined from an unset user-level value because uninspected configuration layers and the ambient process environment may supply or override it. Observed: env.DISABLE_FEEDBACK_COMMAND unset in user config.",
            "observation": "env.DISABLE_FEEDBACK_COMMAND unset in user config",
            "remediation": null,
            "source": {
              "url": "https://code.claude.com/docs/en/data-usage",
              "retrieved": "2026-08-13"
            },
            "valid_from": "<=2.1.223",
            "valid_until": "2.1.223",
            "unknown_reason": null,
            "verify_url": null,
            "stale_reason": "detected version 9.9.9 is outside every tested range (max tested 2.1.223)"
          },
          {
            "rule_id": "claude-code-feedback-survey-opt-out-01",
            "status": "stale-ruleset",
            "severity": null,
            "confidence": null,
            "evidence_class": "official-documentation",
            "message": "Unverified — last-known rule indicates: Effective session quality survey posture cannot be determined from an unset user-level value because uninspected configuration layers, other documented disable paths, and the ambient process environment may supply or override it. Observed: env.CLAUDE_CODE_DISABLE_FEEDBACK_SURVEY unset in user config.",
            "observation": "env.CLAUDE_CODE_DISABLE_FEEDBACK_SURVEY unset in user config",
            "remediation": null,
            "source": {
              "url": "https://code.claude.com/docs/en/data-usage",
              "retrieved": "2026-08-13"
            },
            "valid_from": "<=2.1.223",
            "valid_until": "2.1.223",
            "unknown_reason": null,
            "verify_url": null,
            "stale_reason": "detected version 9.9.9 is outside every tested range (max tested 2.1.223)"
          },
          {
            "rule_id": "claude-code-telemetry-opt-out-01",
            "status": "stale-ruleset",
            "severity": null,
            "confidence": null,
            "evidence_class": "official-documentation",
            "message": "Unverified — last-known rule indicates: The inspected user-level settings.json sets env.DISABLE_TELEMETRY = \"1\", opting out of Claude Code's usage-metrics telemetry. Observed: env.DISABLE_TELEMETRY = \"1\".",
            "observation": "env.DISABLE_TELEMETRY = \"1\"",
            "remediation": null,
            "source": {
              "url": "https://code.claude.com/docs/en/data-usage",
              "retrieved": "2026-08-13"
            },
            "valid_from": "<=2.1.223",
            "valid_until": "2.1.223",
            "unknown_reason": null,
            "verify_url": null,
            "stale_reason": "detected version 9.9.9 is outside every tested range (max tested 2.1.223)"
          }
        ]
      }
    ],
    "summary": {
      "tools_scanned": 1,
      "warning": 0,
      "info": 0,
      "unknown": 0,
      "stale": 5,
      "passed": 0
    }
  }
}
