{
  "schema_version": "1.0",
  "case": "hardened",
  "description": "The documented safe values are configured at user scope for every codex rule, for the exact latest certified synthetic Codex version.",
  "expected_report": {
    "ruleset_version": "2026.08.13",
    "network_requests_made": 0,
    "tools": [
      {
        "tool": "codex",
        "detected_version": "0.147.0",
        "detection_confidence": "high",
        "rules_last_verified_version": "0.147.0",
        "rules_verified_date": "2026-08-13",
        "version_in_range": true,
        "findings": [
          {
            "rule_id": "codex-analytics-01",
            "status": "pass",
            "severity": null,
            "confidence": "high",
            "evidence_class": "official-documentation",
            "message": "The inspected user-level config disables anonymous usage and health metrics collection (analytics.enabled = false).",
            "observation": "analytics.enabled = false",
            "remediation": null,
            "source": {
              "url": "https://learn.chatgpt.com/docs/config-file/config-reference",
              "retrieved": "2026-08-13"
            },
            "valid_from": "<=0.147.0",
            "valid_until": "0.147.0",
            "unknown_reason": null,
            "verify_url": null,
            "stale_reason": null
          },
          {
            "rule_id": "codex-feedback-01",
            "status": "pass",
            "severity": null,
            "confidence": "high",
            "evidence_class": "official-documentation",
            "message": "The inspected user-level config disables the /feedback submission channel (feedback.enabled = false).",
            "observation": "feedback.enabled = false",
            "remediation": null,
            "source": {
              "url": "https://learn.chatgpt.com/docs/config-file/config-reference",
              "retrieved": "2026-08-13"
            },
            "valid_from": "<=0.147.0",
            "valid_until": "0.147.0",
            "unknown_reason": null,
            "verify_url": null,
            "stale_reason": null
          },
          {
            "rule_id": "codex-history-persist-01",
            "status": "pass",
            "severity": null,
            "confidence": "high",
            "evidence_class": "official-documentation",
            "message": "The inspected user-level config sets history.persistence = \"none\".",
            "observation": "history.persistence = \"none\"",
            "remediation": null,
            "source": {
              "url": "https://learn.chatgpt.com/docs/config-file/config-reference",
              "retrieved": "2026-08-13"
            },
            "valid_from": "<=0.147.0",
            "valid_until": "0.147.0",
            "unknown_reason": null,
            "verify_url": null,
            "stale_reason": null
          },
          {
            "rule_id": "codex-otel-prompt-log-01",
            "status": "pass",
            "severity": null,
            "confidence": "high",
            "evidence_class": "official-documentation",
            "message": "The inspected user-level config keeps raw user prompts redacted from OpenTelemetry logs (otel.log_user_prompt = false).",
            "observation": "otel.log_user_prompt = false",
            "remediation": null,
            "source": {
              "url": "https://learn.chatgpt.com/docs/config-file/config-reference",
              "retrieved": "2026-08-13"
            },
            "valid_from": "<=0.147.0",
            "valid_until": "0.147.0",
            "unknown_reason": null,
            "verify_url": null,
            "stale_reason": null
          }
        ]
      }
    ],
    "summary": {
      "tools_scanned": 1,
      "warning": 0,
      "info": 0,
      "unknown": 0,
      "stale": 0,
      "passed": 4
    }
  }
}
