{
  "schema_version": "1.0",
  "case": "version-out-of-range",
  "description": "Safe-looking values with a synthetic version beyond the tested range conservatively produce a stale-ruleset result for every grok-build rule.",
  "expected_report": {
    "schema_version": "1.1",
    "ruleset_version": "2026.08.13",
    "network_requests_made": 0,
    "tools": [
      {
        "tool": "grok-build",
        "detected_version": "9.9.9",
        "detection_confidence": "high",
        "rules_last_verified_version": "1.0.3",
        "rules_verified_date": "2026-08-13",
        "version_in_range": false,
        "findings": [
          {
            "rule_id": "grok-build-feedback-01",
            "status": "stale-ruleset",
            "severity": null,
            "confidence": null,
            "evidence_class": "official-documentation",
            "message": "Unverified \u2014 last-known rule indicates: The inspected user-level config disables the feedback system (features.feedback = false). Observed: features.feedback = false.",
            "observation": "features.feedback = false",
            "remediation": null,
            "source": {
              "url": "https://github.com/xai-org/grok-build/blob/main/crates/codegen/xai-grok-pager/docs/user-guide/05-configuration.md",
              "retrieved": "2026-08-13"
            },
            "valid_from": "<=1.0.3",
            "valid_until": "1.0.3",
            "unknown_reason": null,
            "verify_url": null,
            "stale_reason": "detected version 9.9.9 is outside every tested range (max tested 1.0.3)"
          },
          {
            "rule_id": "grok-build-otel-prompt-log-01",
            "status": "stale-ruleset",
            "severity": null,
            "confidence": null,
            "evidence_class": "official-documentation",
            "message": "Unverified \u2014 last-known rule indicates: The inspected user-level config keeps raw user prompts redacted from external OpenTelemetry logs (telemetry.otel_log_user_prompts = false). Observed: telemetry.otel_log_user_prompts = false.",
            "observation": "telemetry.otel_log_user_prompts = false",
            "remediation": null,
            "source": {
              "url": "https://github.com/xai-org/grok-build/blob/main/crates/codegen/xai-grok-pager/docs/user-guide/05-configuration.md",
              "retrieved": "2026-08-13"
            },
            "valid_from": "<=1.0.3",
            "valid_until": "1.0.3",
            "unknown_reason": null,
            "verify_url": null,
            "stale_reason": "detected version 9.9.9 is outside every tested range (max tested 1.0.3)"
          },
          {
            "rule_id": "grok-build-telemetry-01",
            "status": "stale-ruleset",
            "severity": null,
            "confidence": null,
            "evidence_class": "official-documentation",
            "message": "Unverified \u2014 last-known rule indicates: The inspected user-level config disables the product telemetry master switch (features.telemetry = false). Observed: features.telemetry = false.",
            "observation": "features.telemetry = false",
            "remediation": null,
            "source": {
              "url": "https://github.com/xai-org/grok-build/blob/main/crates/codegen/xai-grok-pager/docs/user-guide/05-configuration.md",
              "retrieved": "2026-08-13"
            },
            "valid_from": "<=1.0.3",
            "valid_until": "1.0.3",
            "unknown_reason": null,
            "verify_url": null,
            "stale_reason": "detected version 9.9.9 is outside every tested range (max tested 1.0.3)"
          },
          {
            "rule_id": "grok-build-trace-upload-01",
            "status": "stale-ruleset",
            "severity": null,
            "confidence": null,
            "evidence_class": "official-documentation",
            "message": "Unverified \u2014 last-known rule indicates: The inspected user-level config disables session/trace uploads (telemetry.trace_upload = false). Observed: telemetry.trace_upload = false.",
            "observation": "telemetry.trace_upload = false",
            "remediation": null,
            "source": {
              "url": "https://github.com/xai-org/grok-build/blob/main/crates/codegen/xai-grok-pager/docs/user-guide/05-configuration.md",
              "retrieved": "2026-08-13"
            },
            "valid_from": "<=1.0.3",
            "valid_until": "1.0.3",
            "unknown_reason": null,
            "verify_url": null,
            "stale_reason": "detected version 9.9.9 is outside every tested range (max tested 1.0.3)"
          }
        ]
      }
    ],
    "summary": {
      "tools_scanned": 1,
      "warning": 0,
      "info": 0,
      "unknown": 0,
      "stale": 4,
      "passed": 0
    }
  }
}
