{
  "schema_version": "1.0",
  "case": "missing",
  "description": "Neither a synthetic Claude Code home nor a Claude Code PATH marker exists, so the tool is not detected.",
  "expected_report": {
    "ruleset_version": "2026.08.13",
    "network_requests_made": 0,
    "tools": [],
    "summary": {
      "tools_scanned": 0,
      "warning": 0,
      "info": 0,
      "unknown": 0,
      "stale": 0,
      "passed": 0
    }
  }
}
