{
  "schema_version": "1.0",
  "case": "version-out-of-range",
  "description": "Safe-looking and unset values with a synthetic version beyond the tested range conservatively produce a stale-ruleset result for every codex rule.",
  "expected_report": {
    "ruleset_version": "2026.08.13",
    "network_requests_made": 0,
    "tools": [
      {
        "tool": "codex",
        "detected_version": "9.9.9",
        "detection_confidence": "high",
        "rules_last_verified_version": "0.147.0",
        "rules_verified_date": "2026-08-13",
        "version_in_range": false,
        "findings": [
          {
            "rule_id": "codex-analytics-01",
            "status": "stale-ruleset",
            "severity": null,
            "confidence": null,
            "evidence_class": "official-documentation",
            "message": "Unverified — last-known rule indicates: Effective usage analytics telemetry posture cannot be determined from an unset user-level value because uninspected configuration layers may supply or override it. Observed: analytics.enabled unset in user config.",
            "observation": "analytics.enabled unset in user config",
            "remediation": null,
            "source": {
              "url": "https://learn.chatgpt.com/docs/config-file/config-reference",
              "retrieved": "2026-08-13"
            },
            "valid_from": "<=0.147.0",
            "valid_until": "0.147.0",
            "unknown_reason": null,
            "verify_url": null,
            "stale_reason": "detected version 9.9.9 is outside every tested range (max tested 0.147.0)"
          },
          {
            "rule_id": "codex-feedback-01",
            "status": "stale-ruleset",
            "severity": null,
            "confidence": null,
            "evidence_class": "official-documentation",
            "message": "Unverified — last-known rule indicates: Effective feedback submission channel posture cannot be determined from an unset user-level value because uninspected configuration layers may supply or override it. Observed: feedback.enabled unset in user config.",
            "observation": "feedback.enabled unset in user config",
            "remediation": null,
            "source": {
              "url": "https://learn.chatgpt.com/docs/config-file/config-reference",
              "retrieved": "2026-08-13"
            },
            "valid_from": "<=0.147.0",
            "valid_until": "0.147.0",
            "unknown_reason": null,
            "verify_url": null,
            "stale_reason": "detected version 9.9.9 is outside every tested range (max tested 0.147.0)"
          },
          {
            "rule_id": "codex-history-persist-01",
            "status": "stale-ruleset",
            "severity": null,
            "confidence": null,
            "evidence_class": "official-documentation",
            "message": "Unverified — last-known rule indicates: The inspected user-level config sets history.persistence = \"none\". Observed: history.persistence = \"none\".",
            "observation": "history.persistence = \"none\"",
            "remediation": null,
            "source": {
              "url": "https://learn.chatgpt.com/docs/config-file/config-reference",
              "retrieved": "2026-08-13"
            },
            "valid_from": "<=0.147.0",
            "valid_until": "0.147.0",
            "unknown_reason": null,
            "verify_url": null,
            "stale_reason": "detected version 9.9.9 is outside every tested range (max tested 0.147.0)"
          },
          {
            "rule_id": "codex-otel-prompt-log-01",
            "status": "stale-ruleset",
            "severity": null,
            "confidence": null,
            "evidence_class": "official-documentation",
            "message": "Unverified — last-known rule indicates: Effective OpenTelemetry raw prompt export posture cannot be determined from an unset user-level value because uninspected configuration layers may supply or override it. Observed: otel.log_user_prompt unset in user config.",
            "observation": "otel.log_user_prompt unset in user config",
            "remediation": null,
            "source": {
              "url": "https://learn.chatgpt.com/docs/config-file/config-reference",
              "retrieved": "2026-08-13"
            },
            "valid_from": "<=0.147.0",
            "valid_until": "0.147.0",
            "unknown_reason": null,
            "verify_url": null,
            "stale_reason": "detected version 9.9.9 is outside every tested range (max tested 0.147.0)"
          }
        ]
      }
    ],
    "summary": {
      "tools_scanned": 1,
      "warning": 0,
      "info": 0,
      "unknown": 0,
      "stale": 4,
      "passed": 0
    }
  }
}
