{
  "schema_version": "1.0",
  "case": "permission-denied",
  "description": "The committed base is mutated in a temporary directory so settings.json cannot be read, producing an unknown result for every claude-code rule.",
  "expected_report": {
    "ruleset_version": "2026.08.13",
    "network_requests_made": 0,
    "tools": [
      {
        "tool": "claude-code",
        "detected_version": "2.1.223",
        "detection_confidence": "high",
        "rules_last_verified_version": "2.1.223",
        "rules_verified_date": "2026-08-13",
        "version_in_range": true,
        "findings": [
          {
            "rule_id": "claude-code-cleanup-period-01",
            "status": "unknown",
            "severity": null,
            "confidence": null,
            "evidence_class": null,
            "message": "Cannot determine local session transcript retention window: config file is not readable (permission denied)",
            "observation": null,
            "remediation": null,
            "source": null,
            "valid_from": "<=2.1.223",
            "valid_until": "2.1.223",
            "unknown_reason": "config file is not readable (permission denied)",
            "verify_url": "https://code.claude.com/docs/en/settings",
            "stale_reason": null
          },
          {
            "rule_id": "claude-code-error-reporting-opt-out-01",
            "status": "unknown",
            "severity": null,
            "confidence": null,
            "evidence_class": null,
            "message": "Cannot determine error-reporting opt-out posture: config file is not readable (permission denied)",
            "observation": null,
            "remediation": null,
            "source": null,
            "valid_from": "<=2.1.223",
            "valid_until": "2.1.223",
            "unknown_reason": "config file is not readable (permission denied)",
            "verify_url": "https://code.claude.com/docs/en/data-usage",
            "stale_reason": null
          },
          {
            "rule_id": "claude-code-feedback-command-opt-out-01",
            "status": "unknown",
            "severity": null,
            "confidence": null,
            "evidence_class": null,
            "message": "Cannot determine /feedback command opt-out posture: config file is not readable (permission denied)",
            "observation": null,
            "remediation": null,
            "source": null,
            "valid_from": "<=2.1.223",
            "valid_until": "2.1.223",
            "unknown_reason": "config file is not readable (permission denied)",
            "verify_url": "https://code.claude.com/docs/en/data-usage",
            "stale_reason": null
          },
          {
            "rule_id": "claude-code-feedback-survey-opt-out-01",
            "status": "unknown",
            "severity": null,
            "confidence": null,
            "evidence_class": null,
            "message": "Cannot determine session quality survey opt-out posture: config file is not readable (permission denied)",
            "observation": null,
            "remediation": null,
            "source": null,
            "valid_from": "<=2.1.223",
            "valid_until": "2.1.223",
            "unknown_reason": "config file is not readable (permission denied)",
            "verify_url": "https://code.claude.com/docs/en/data-usage",
            "stale_reason": null
          },
          {
            "rule_id": "claude-code-telemetry-opt-out-01",
            "status": "unknown",
            "severity": null,
            "confidence": null,
            "evidence_class": null,
            "message": "Cannot determine usage-metrics telemetry opt-out posture: config file is not readable (permission denied)",
            "observation": null,
            "remediation": null,
            "source": null,
            "valid_from": "<=2.1.223",
            "valid_until": "2.1.223",
            "unknown_reason": "config file is not readable (permission denied)",
            "verify_url": "https://code.claude.com/docs/en/data-usage",
            "stale_reason": null
          }
        ]
      }
    ],
    "summary": {
      "tools_scanned": 1,
      "warning": 0,
      "info": 0,
      "unknown": 5,
      "stale": 0,
      "passed": 0
    }
  }
}
